{"$schema":"https://json-schema.org/draft/2020-12/schema","title":"domain.visibility/v1 row","type":"object","required":["target","scope","locale","observed_at","metrics"],"properties":{"target":{"type":"string"},"scope":{"type":"string"},"locale":{"type":"string"},"observed_at":{"type":"string"},"metrics":{"type":"array","minItems":1,"maxItems":64,"items":{"type":"object"}}},"additionalProperties":false}
